,portions_nowar,portions_z,keywords
0,0.032814945226917,0.006651017214398,"путин, война, мир"
1,0.0304186228482,0.001467136150235,"война, мир, друг"
2,0.011199139280125,0.020588810641628,"россия, санкция, газ, экономика, запад"
3,0.000537949921753,0.019219483568075,"сталинградский, сталинградская битва, сталинградская победа, 70 отца, дед сделать"
4,0.001173708920188,0.041079812206573,"помощь, гуманитарная помощь, единая россия, житель, центр"
5,0.001809467918623,0.018339201877934,"россия, единая россия, пациент, врач, помощь"
6,0.004499217527387,0.021664710485133,"референдум, херсонский запорожский, херсонская область, вхождение состава, запорожский херсонский"
7,0.007091158059468,0.010074334898279,"фашизм, война, нацизм, мир, фашист"
8,0.011688184663537,0.011492566510172,"песня, война, музыка, клип"
10,0.000342331768388,0.015747261345853,"армия, солдат, поддерживать, военный, поддержка"
11,0.004010172143975,0.005770735524257,"уничтожать, всу, район населенный, населенный пункт, военный"
12,0.00547730829421,0.006357589984351,"россия, информация, фейк, информационная война"
13,0.002396322378717,0.009634194053208,"соревнование, спортивный, болельщик, спортсмен, турнир"
14,0.010465571205008,0.000195618153365,"страшно бессильный, прикасаться душа, тропа, друг брата"
15,0.003765649452269,0.017507824726135,"письмо, поддержка, письмо солдата, акция письма, рисунок"
16,0.008411580594679,0.001320422535211,"мир, война, любовь, жизнь, друг"
17,0.006161971830986,0.000733568075117,"погибать, потеря, война"
18,0.001320422535211,0.007971439749609,"противник, националист, сержант, лейтенант, подразделение"
19,0.004303599374022,0.001173708920188,"пожар, взрыв"
20,0.006015258215962,0.005428403755869,"русский, русский мир, война"
21,0.003325508607199,0.002298513302034,"вертолет, дрон, беспилотник, поц"
22,0.006259780907668,0.001369327073552,"суд, свобода срока, лишение свободы, штраф, уголовный"
23,0.012764084507042,0.003912363067293,"митинг, война, выходить митинг, протест, антивоенный"
24,0.000244522691706,0.012177230046948,"единая россия, региональное отделение, отделение партии, единая партия, помощь"
25,0.004841549295775,0.000635758998435,"украина, помощь"
26,0.005770735524257,0.005134976525822,"зеленский, зеленский владимир, война, президент"
27,0.001222613458529,0.01775234741784,"президент, поддерживать президент, гордиться, решение президента, спецоперация"
28,0.003227699530516,0.003032081377152,мобилизация
30,0.002689749608764,0.006553208137715,"книга, библиотека, литература, учебник, русский"
31,0.001418231611894,0.005232785602504,"россия, временное размещение, временный пункт, единая россия, волонтер"
32,0.000489045383412,0.005868544600939,"ставка, кредит, льготный, ипотека, правительство"
33,0.002689749608764,0.007775821596244,"концерт, благотворительный концерт"
34,0.000782472613459,0.00973200312989,"семья, семья мобилизовать, помощь семьи, заявка, поддержка"
35,0.003032081377152,0.011639280125196,"крым, крым россии, воссоединение крыма, крым севастополя, 18 марта"
36,0.000391236306729,0.006113067292645,"выплата, доход, семья, пособие, рубль"
37,0.000293427230047,0.006015258215962,"пункт обогрева, россия readovka, обогрев жителя, единая россия, местное число"
38,0.000929186228482,0.008264866979656,"герой, военный гордиться, народ региона, солдат"
39,0.000684663536776,0.008362676056338,"медаль, вручать, медаль отваги, военный, государственная награда"
41,0.005575117370892,0.001907276995305,"видео, фильм"
42,0.004303599374022,0.006846635367762,флаг
43,0.007433489827856,0.001320422535211,"мать, ребенок, война, убивать, солдат"
44,0.000146713615023,0.004939358372457,"калашников, оборонная промышленность, автомат, михаил калашников"
45,0.002836463223787,0.000733568075117,"выпуск, новость хреновости, вечерний выпуск, утренний выпуск, остановка"
46,0.001467136150235,0.006064162754304,"флот, военноморский флот, вмф, флот россии, андреевский флага"
47,0.004059076682316,0.000195618153365,"страх, стресс, помогать, страшно"
48,0.008069248826291,0.000391236306729,"петиция, подписывать петицию, петиция против войны"
49,0.003080985915493,0.002836463223787,"мост, крымский мост"
50,0.000391236306729,0.004499217527387,"производство, производитель, информация импортозамещения, рынок, предприятие"
51,9.78090766823161E-05,0.00381455399061,"посылка, тепло родной, шить, маскировочный, теплый"
53,0.002983176838811,0.001320422535211,"православный, патриарх, православная церковь, русский православный, война"
54,0.005428403755869,0.00337441314554,"переговоры, война, военный"
55,0.003570031298905,0.000146713615023,"политика, друг, война"
58,0.001173708920188,0.004841549295775,"новогодний, новогодняя ёлка, ребенок, новогодний подарок, новый"
59,0.000489045383412,0.003667840375587,"мемориал, монумент, мемориальный комплекс"
60,0.003765649452269,0.008802816901408,"беженец, украинский беженец, помогать, война, беженец донбасса"
61,0.002738654147105,0.000733568075117,"собака, дом разрушать, корова, пес, кошка"
62,0.000293427230047,0.003863458528951,"вциом, президент, опрос, доверие владимира, положительно отвечать"
63,0.001075899843505,0.006259780907668,"домой, вернуться домой, ждать домой, победа, воин защищать"
64,0.00337441314554,4.89045383411581E-05,"украина, война, жить, мир, друг (личные связи с Украиной)"
65,0.006455399061033,0.001858372456964,"весна, война, мир"
66,0.00127151799687,0.001075899843505,"зерно, порт, авиакомпания"
67,0.002005086071987,0.007433489827856,"защитник отечества, праздник, поздравлять"
68,0.002200704225352,0.005624021909233,"памятник, советский памятник"
70,0.005379499217527,0.015747261345853,"спасибо, помощь, ребята"
71,0.002396322378717,0.000489045383412,"линия огня, дорожный"
72,0.004303599374022,0.000733568075117,"беларусь, беларусі, тэрыторыі, агрэсіі, супраць"
73,0.000684663536776,0.00973200312989,"волонтер, помощь, единая россия, единый волонтёр, житель"
74,0.003325508607199,0.00210289514867,"китай, война, россия китая"
75,0.005672926447574,0.001467136150235,"эфир, прямой эфир, война, телемарафон"
76,9.78090766823161E-05,0.004597026604069,"вдв, воздушнодесантное войско, вдв самый, войско являть, десантник протяжения"
77,0.001173708920188,0.002298513302034,"государственность, 1918, государство, состав ссср, государственность сформировывать"
78,0.000146713615023,0.00420579029734,"льгота, статус ветерана, боевой ветеран, доброволец, сво"
81,0.001320422535211,0.003716744913928,"стихотворение, поэт, стих, патриотическое стихотворение"
82,0.000684663536776,0.006308685446009,"флешмоб, флешмоб поддержки, российская поддержка, присоединяться"
83,0.000342331768388,0.001956181533646,"россия, операция, президент, спецоперация, военный"
84,0.001320422535211,0.004010172143975,"пво, противовоздушная оборона, противовоздушное войско, войско пво, зенитный"
85,0.000782472613459,0.002934272300469,"препарат, лекарство, лекарственный препарат"
87,0.000146713615023,0.002053990610329,"турист, туризм, грант, агротуризм, белоруссия лета"
89,0.001907276995305,0.003863458528951,"мариуполь, город, азовское море, освобождение мариуполя, донбасский ход"
90,4.89045383411581E-05,0.003129890453834,"строитель, студенческий отряд, донбасс, строительная отрасль, российский студенческий"
91,0.000244522691706,0.002151799687011,"вуз, абитуриент, егэ, экзамен, школа"
92,0.00254303599374,0.001564945226917,"аэс, запорожская аэс, энергоблок, чернобыльский, атомная электростанция"
93,0.003080985915493,0.009047339593114,"россия, независимость, днр лнр, война, донбасс"
94,0.000146713615023,0.001858372456964,"президент, говорить тысячелетний, должный настоящий, история слова, огромная перспектива"
95,0.000733568075117,0.002591940532081,"тактическая медицина, медицина военнослужащего, тактическая аптечка, тактический курс, военнослужащий донбасса"
,,,
,,,
"Удаляем темы в связи с бессмысленностью: 9, 29, 40, 52, 56, 57, 69, 79, 80, 86, 88",,,
"Меняем название, чтобы стало понятнее: 19, 28, 42, 44, 48, 59, 64",,,
